post_id,title,selftext,subreddit_name,author,score,upvote_ratio,num_comments,created_utc,flair,url,is_self,label
1k6igkk,AITA for freaking out when my mom has to watch me and my brother alone?,"I am 14F with a 13M brother with OCD. My mom has a habit of setting off my brother's OCD and on occasion yelling at him or ""grounding him"" to our room when he gets upset at this. This isn't usually a problem with my dad around and is the basis of this post.

Next week my dad is driving my half-brother back from college and my mom has to watch me and my brother and I freaked out a bit and my mom thinks I'm being an asshole and over reacting. I love my mom, but when ever she watches me and my brother without my dad to mediate, things go to shit really quickly. 

One of the recent times she has watched us, she was yelling at my brother and going to far. She was standing in the door way of our room so I grabbed her arm and tried to pull her away. We got in an argument that lead to me having a breakdown. (I won't go into too much detail because this isn't the main focus)

Anyways, my brother's OCD has been worse lately, so I'm really worried about this upcoming week and what could happen. I know from my mom's POV, seeing me anxious and dreading the week she gets to watch me and my brother could feel heart breaking, but I can't see a way for me to just drop everything that has happened in the past. I feel awful about it but I know what these times can do to me and my brother, so AITA?",AmItheAsshole,Just_A_RandomMate,5,0.78,12,2025-04-24 03:25:04+00:00,Not the A-hole,https://www.reddit.com/r/AmItheAsshole/comments/1k6igkk/aita_for_freaking_out_when_my_mom_has_to_watch_me/,True,Not the A-hole
1k6hyib,AITA to ask my brother M19 to not voice chat with his friends at night?,"I F23 work full time and have to wake up at around 6 a.m. 
My little brother 19 M is done with school for now and is on break, he will be starting a job soon..
Every night at around 10 when I head to bed he is talking to his friends and it's loud, we share a wall I can hear him clear as day. 
This has been an ongoing fight for 7 years and he says I'm unreasonable, shakes his head and ignores me when I try to explain my frustration. 
Am I actually being an asshole? ",AmItheAsshole,thecoolbabushka,16,0.86,27,2025-04-24 02:58:04+00:00,Not the A-hole,https://www.reddit.com/r/AmItheAsshole/comments/1k6hyib/aita_to_ask_my_brother_m19_to_not_voice_chat_with/,True,Not the A-hole
1k6gmp6,AITA for not letting my bf use my desk chair?,"I (34NB) and my bf(35M) have been living together for 9 months now, and just had and uncomfortable convo today about me not letting him use my desk chair.
Some info is:
- we have individual desks and individual desk chairs. 
- he bought his chair in the last months and before that he borrowed mine from time to time.
- I come from a better off family, but I we are both professionals (studied at uni) and we both earn almost exactly the same monthly.
- his chair is way cheaper that mine (like mine is maybe 3x) and he bought the very cheapest that he could found.
- his chair is really uncomfortable and uses mine when I'm not home.
- I came into the relationship with more material stuff and several of the furniture and appliances are originally mine but we both use them. Now when we buy things for the home we both pay 50/50 for it and also we share 50/50 on rent, bills and groceries.

Today I came home and asked him why he was using my chair (and desk) I told him he could use it if he promised to buy a new chair in a few months when he receives a bonus from a new project. Maybe I didn't use the best tone tho, but I tried to be civil.

He said he won't use my chair anymore but got really sad and later called me egoist and materialistic.
Im hurt and think he's being kinda freeloader.

He has borrowed some things a few times before and I ended up give them up to him because he worn them out.

I'm and being egoist? I'm afraid this will continue to happen because he tends to buy cheap and I tend to buy things to last.
",AmItheAsshole,Clear-College341,59,0.69,100,2025-04-24 01:54:26+00:00,Not the A-hole,https://www.reddit.com/r/AmItheAsshole/comments/1k6gmp6/aita_for_not_letting_my_bf_use_my_desk_chair/,True,Not the A-hole
1k6g0wj,AITA for telling my wife to quit smoking,"Am I the asshole for telling my wife to quit smoking? My wife likes to smoke marijuana and cigarettes, but I tell her for her own health and financial reasons that I think it would be best if she did either or not both of them. I tell her that she is only damaging her lungs in the long run, but she tells me that I am being too controlling with what she does. So I compromised with her and told her that if she want to do both then she has to use her own money for it not our joint account or my money or save the money to get it herself and that I will not be going to buy them for her. So AITA?",AmItheAsshole,OhThePlac3sYouWillGo,57,0.7,163,2025-04-24 01:24:13+00:00,Not the A-hole,https://www.reddit.com/r/AmItheAsshole/comments/1k6g0wj/aita_for_telling_my_wife_to_quit_smoking/,True,Not the A-hole
1k6flrt,AITA for not sharing my switch,"So me 14f and my younger sister 12f have our own switches. I have the original switch and she has the switch lite.(she asked for it) My sister has asked me multiple times to borrow my switch to play games that she can’t play on the lite. I said no cause i using it at the time and she left. After that, she would nonstop bother me about using my switch for games after I continuously said no. Then my parents got involved and they decided to just buy her own switch instead as an early Christmas gift. They still bother me to this day about how selfish i was for not sharing. Mind you I am autistic i never really feel comfortable with other people using my things.
",AmItheAsshole,Top-Material7189,4,0.64,11,2025-04-24 01:02:42+00:00,Not the A-hole,https://www.reddit.com/r/AmItheAsshole/comments/1k6flrt/aita_for_not_sharing_my_switch/,True,Not the A-hole
1k6f7ew,AITA for trying to set a boundary with my mom?,"I (23M) had to move back in with my mom (56F) about 3 months ago after my apartment complex was shut down due to black mold. I originally planned to move into another place with my roommate and his girlfriend, but my mom convinced me it’d be smarter to live at home for a year, save money, buy a car, and finish school. Financially, it made sense, so I agreed, reluctantly. We’ve always clashed and don’t see eye to eye on much.

The main issue is her passive-aggressive behavior and setting unspoken expectations. She’ll get upset when things don’t go as she imagined, even if nothing was agreed on.

For example, I’ve been trying to cut sugar and started buying drinks like sugar-free soda to test out. I picked up a $3 bottle of sugar-free Mountain Dew to try before committing to a 12-pack. She was with me and agreed it was a smart idea.

Later that week, I come home from the gym and she casually mentions how good the drink was. I go to get some and it’s gone. My dad laughs and says, “It’s already gone.” I got annoyed and said it would’ve been nice if someone had asked. She immediately got defensive and said, “Well how do you think I feel?” as if she was the one wronged. We argued, I left to cool off.

I vented to my girlfriend, who showed up later with a 12-pack (super sweet and unprompted). When my mom saw it, she said, “Really? You made her go get you more?” I explained what happened and she laughed, told me to “man up” and stop “bitching” that I could’ve just bought another bottle. I said that was unkind, especially when I was clear about wanting to try it first.

Then today: I bought chicken with my sister and put it in the basement fridge (the one my mom rarely checks). I went to grab it later, and my mom followed me into my room and said, “You little brat, you’re not going to share that?” I told her I bought it. She brought up how much food I’ve eaten in the house. I reminded her I mostly eat only when she invites me to dinner and buy my own snacks/drinks.

She gave me this smug smile and said, “Okay, I’ll remember that.” I told her I don’t mind sharing I’d just like to be asked. She snapped, “I don’t need to ask.” I offered her some anyway and she responded with, “No thank you, I don’t want it anymore,” in this weirdly smug tone and walked away.

I was left just sitting there, stunned. I don’t feel like I’m doing anything wrong, but when I set basic boundaries, she acts like I’ve insulted her. She constantly brings up how much I ate as a teen, even though I’ve been trying to be respectful and self-sufficient. These are just a couple recent examples, but it’s been like this since I moved back.

So, AITA? I feel like I’m going crazy trying to navigate this dynamic. I try to act like an adult, but it feels like I’m walking on eggshells",AmItheAsshole,frick_fracc_,48,0.93,44,2025-04-24 00:42:42+00:00,Not the A-hole,https://www.reddit.com/r/AmItheAsshole/comments/1k6f7ew/aita_for_trying_to_set_a_boundary_with_my_mom/,True,Not the A-hole
1k6f09d,AITA for publicly shaming two elderly neighbors and filing a lawsuit against them?,"So, I (M, 30s) live in a mid-sized apartment building with a pretty standard setup: there’s a building council that oversees maintenance, budget, admin stuff, etc. Everything went relatively smooth until two elderly neighbors — let’s call them Mike and Mod (both in their 60s-70s) — decided to make the building their personal chessboard.

Mike and Mod got themselves voted onto the council this year, but not exactly by the book. They took over the annual assembly as “president” and “secretary” of the session (despite not being neutral parties), changed the voting rules mid-meeting, and ignored every objection that didn’t suit them. The official minutes that came out later? Full of omissions and lies — including a claim that the vote for the council (which they now sat on) was *unanimous*. Spoiler: it wasn’t. I was the only one actually voted in through real consensus.

Since then, they’ve overstepped their role over and over — publishing official documents before they were even registered with local authorities, acting on behalf of the building without authorization, and most recently trying to get me to sign off on a contract ""*as a council""* without even involving the building’s administrator. That’s illegal where we live.

Earlier this year, Mike  made a completely false claim that the community could be subject to asset seizures due to a pending labor lawsuit — again, not how the law works. I’m fairly certain that was meant to scare everyone into letting them settle things without review or transparency.

I tried to handle things quietly. I’ve been patient. I’ve offered peaceful ways out. But now? I’ve filed a lawsuit to challenge the legitimacy of the assembly minutes and their actions. I’m also preparing a full public report to the community, detailing everything — and yeah, it names names.

I’ve been told I’m being petty, or cruel — that they’re elderly and maybe they didn’t mean harm. But at some point, “not meaning harm” still leads to serious consequences. They’ve lied, manipulated, and acted like they were above oversight. The community deserves the full truth.

**AITA for going full transparency mode and dragging them publicly (and legally) after trying to keep things civil for months?**

**TL;DR**: Two elderly neighbors hijacked the building council through sketchy means, lied in the official records, overstepped their legal authority multiple times, and spread misinformation. After months of trying to handle it quietly, I filed a lawsuit and went public with the receipts. Now some say I’m being mean to old folks. AITA?",AmItheAsshole,Zadel88,2833,0.96,152,2025-04-24 00:32:31+00:00,Not the A-hole,https://www.reddit.com/r/AmItheAsshole/comments/1k6f09d/aita_for_publicly_shaming_two_elderly_neighbors/,True,Not the A-hole
1k6cvh7,AITA for leaving to have my break in another room when someone else walked into the one I was already in?,"Apologies for any grammer mistakes, writing this in a waiting room and I think im being called up next so im not really spell checking anything. 

Okay so for some context my workplace has 4 small break rooms. We're allowed to take our breaks whenever we want and because we dont have alot of employees at the moment most of the time when I take my break no one else is present in any of the rooms. 

I prefer the quiet since being yelled at by customers constantly gives me quite the headache, and im pretty introverted normally so I quite enjoy break time. The break room I prefer to use is labled as ""room A"" and its where my and a few others lockers are located. 

Okay now, I was enjoying my break as normal and my co-worker Selly walked in to grab something from their locker, shortly after their phone rang and they took the call. They were in this call for only about 2 minutes, and it didn't sound like they were gonna end it anytime soon, so I moved to break room B. This wasnt out of malice or anything, I just like my peace and quiet.  

The next day I noticed the stickynote that labled my locker was missing, I assumed it fell off, put a new one on it, and went to start my day. Break time hits and theres someone in room A so I go to room B and thats when I found my old stickynote on a random unused locker. I was confused and asked the guy that was in room A if he knew who moved it and why. He said ""Oh Selly moved it because he thought you were going to move lockers anyway."" This answer was very confusing so I went and found Selly to ask him myself if he was the one who moved it and why. 

After I asked he said ""Oh I thought you wanted a room to yourself since you so rudely left room A when I walked in for only a moment"". I told him that me leaving had nothing to do with him, and that I just liked the quiet, but his response was something like ""well now you can have all the peace and quiet you want"" and got into his car before I could respond.  

He seemed really mad, and honestly I just want to know if I really did do something wrong. I dont always catch if im being rude so maybe I really am the asshole here, thus I wrote this post to find out. 

Edit: I didn't expect this post to blow up, hahah... thank you for your comments everyone! I will be talking to HR tomorrow about the situation. Im glad to see I wasn't accidentally being rude. thanks again!",AmItheAsshole,due_time_for_a_party,2043,0.98,61,2025-04-23 22:51:41+00:00,Not the A-hole,https://www.reddit.com/r/AmItheAsshole/comments/1k6cvh7/aita_for_leaving_to_have_my_break_in_another_room/,True,Not the A-hole
1k6clcy,WIBTA for not going to a friends wedding because I didn't get invited to the reception?,"I (27F) got invited to a friend's (27F) wedding. I wasn't expecting an invite, as we only know each other because I went to high school with her childhood friends and we all started hanging out together in high school and throughout university. We usually see each other once a year, sometimes twice, and we have a pretty active group chat.

The wedding would require quite a bit of travel, either a $700 flight or a 16 hour car ride. I don't have much vacation time left, but I was willing to use it and make the wedding part of a longer vacation. The invite that I was sent only listed information for the ceremony and refreshments afterwards, and I assumed that there would be no reception, which would be a little strange but also cheaper (which is understandable, life is expensive).

The other night I was messaging one of the other girls in the friend group (also 27F) to ask if she was going, as I didn't want to be the only one in our friend group there (except for the bride, we all live within an hour of each other and would all have to travel to the wedding). We chatted about how expensive it would be, some different options for travel, and that was it.

Today I got a message from the bride. She informed me that our mutual friend had mentioned that it might be a good idea to clarify with me that they are keeping the reception very small. Because of this, she only invited the 3 other people in our friend group to the reception, and not me. While I do understand that weddings are expensive, and I'm not one of her closest friends, I'm upset that she singled me out by only inviting me to half the event and didn't feel the need to tell me until someone else mentioned it to her. She did say that if enough people RSVP'd 'no' she could maybe fit me into the reception. Which is nice, but also feels like a pity invite.

I am glad to find out now, instead of after spending a lot of money to go to a wedding and then be ditched by my friends for a reception I'm not welcome at. I honestly would have preferred she not invite me at all, instead of labelling me as a ""tier 2"" friend. Before I found out about the reception, I thought that if I had decided not to go I would still buy the couple a gift to be nice. But now I really don't want to go, and I definitely don't want to send a gift. AITA?",AmItheAsshole,Good-Second-5902,1079,0.96,298,2025-04-23 22:39:22+00:00,Not the A-hole,https://www.reddit.com/r/AmItheAsshole/comments/1k6clcy/wibta_for_not_going_to_a_friends_wedding_because/,True,Not the A-hole
1k6acod,AITA for not letting my sister come to a gig-work shift with me?,"TW: mentions of medical issues, surgery

Background: I (20f) have been undergoing diagnostic evaluation for postural orthostatic tachycardia syndrome (POTS) after having 2-3 severe cardiac events in 1 week back in January. I was medically separated from my patient-facing job (I worked as a patient care tech) 2 weeks after my first event after my doctors wanted me to wait for further testing before going back to work. I was released to still drive and didn’t have any lifting restrictions, and was told to just keep an eye on my rate and try to take it easy as much as possible. I’m a college student. I began doing DoorDash around that time to try and continue to make ends meet. Starting after that and up to now, my parents have been almost 100% supporting me aside from my car note and a loan payment that I’m responsible for. My sister (19f, also a college student at the same college as me) left her job around the same time I was medically separated from mine because she was unhappy with her position (team member at a fast food restaurant (I and my family worked in food for so long, so we held no ill feelings towards her, just as long as she had a job). My parents supported this, so long as she actively sought out another position while she also did DoorDash. This didn’t happen.
I ended up experiencing other medical complications (emergency surgery and a hospital stay) that prevented me from getting a non gig-work job due to weight lifting restrictions during my 6 week recovery. Closer to the end of that 6 weeks, I picked up an opportunity on Walmart Spark to make ends meet a bit better (at least taking care of my food, etc, but without paying anything to my parents. I realize this might make me an AH, to them, for a different reason than this post) than with DoorDash. Just after being medically cleared to lift as normal, I applied for and accepted an offer for a non patient-facing position at a local hospital near my hometown, and I’m supposed to start in a week and a half once we move after the semester ends.
Yesterday, my parents had a serious conversation with us and said they could no longer assist us with our bills, and that we needed to pay our portion by May 10th. My sister has applied for Walmart Spark, but is currently waitlisted and can’t get in. Her benefits on doordash only allow her to dash during a scheduled time period, during which offers are not guaranteed. She asked me today if she could come with me for my Spark block tonight and split some of the money I make with her. I’m currently in a pinch because i haven’t paid my car note or loan payment for this month yet (a total of $455, I notified my credit union as soon as I knew I’d be late due to medical/financial hardship), and I have to have that paid by next Wednesday. Because of this, I had to decline. She is upset because she said she needs money for “something”, she didn’t specify what. I understand her position but I also know I need to take care of my bills first. AITA?",AmItheAsshole,LeadingGeneral4282,28,0.9,14,2025-04-23 21:03:53+00:00,Not the A-hole,https://www.reddit.com/r/AmItheAsshole/comments/1k6acod/aita_for_not_letting_my_sister_come_to_a_gigwork/,True,Not the A-hole
1k69ed9,AITA for deciding to stop talking and not finish the story I was telling my mom after being interrupted again?,"So this might be a minor issue but id like some completely unbiased opinions. 

My mom (56F) and I (25f) have a great relationship, ya we fight sometimes like everyone but on the average we are truly good and id say pretty close.

Having said this we just had a small fight, what happened was I recently read into the new advances happening in technology in the field of genetics and that lead me to cloning etc. Just genuinely interesting and provoking science, so I just wanted to share with her the discoveries and talk about it. So I waited until the time when she is free and on her phone, when we usually hang out together in the living room both doing our own things and started to tell her. Just as I was getting into it, she interrupted me to say my mobile was charging too close to me and to put it far away (cause of radiation). Now normally this wouldn't be a big deal but this exact situation where me or my brother (30 M) would be telling her a story and just as we were getting invested in it, she would interrupt by saying something completely irrelevant and usually just to tell us to do a quick thing; fix t-shirt, comb hair, push a cup from the edge of the table, you get it. Both me and my brother find this incredibly annoying and we would tell her don't do this, it just completely takes the wind out of our sails, makes us feel like she isn't listening and doesn't care. This happened like more than 20 times throughout the years and she sometimes still does it. So this time I got very frustrated told her you did it again just why do you always do this. In her defense she was listening she told me the exact last sentence I said and said okay continue I'm listening. But I just didnt feel like talking anymore tbh, so I told her nah whatever doesnt matter anymore even after she said no continue I didnt and then she said that I am overreacting and that she was listening she said just this quick little thing but she's paying attention. I didnt care anymore and said okay Im done and then the situation ended.

Now I just wanna say I love her and will always appreciate and be grateful to her, I genuinely can't imagine my life without her, even with all her sometimes overbearing and overprotective behaviour.

I say this because I want to make it clear I am not insanely angry right now where I just cant stand her or think clearly, Im very clear headed but I still feel like I'm not sure if i am over reacting. So AITA?",AmItheAsshole,Sapphire_west,127,0.93,56,2025-04-23 20:24:49+00:00,Not the A-hole,https://www.reddit.com/r/AmItheAsshole/comments/1k69ed9/aita_for_deciding_to_stop_talking_and_not_finish/,True,Not the A-hole
1k692rt,AITA - for not disclosing club team opportunity to friends family?,"Back story: We have been friends with this family for couple years, they have kids our kids ages and our oldest plays on volleyball team with theirs. We share driving duties to practice and other things - it's good relationship.

Last week Sunday (4/13) my child tried out for a club team that we told them about, they tried out as well and invited another family to try out too. Great. The next day I wrote our current coach about said club. He said it was fine but suggested our child try this club we had previously tried out for, and offered to introduce us to coaches.

This setoff a complicated timeline for us, we had 1 week from 4/14 to accept the offer from Club 1 ( lower ranked and a combined age team) or try for Club 2( higher ranked and better organization). We initially told our friends we were going to join Club 1 but didn't really know for sure, nor could we really share the info about coach recommending our child. I requested an extension from club 1, an additional week and got it. 

Club 2 didn't get in touch until after initial timeline had elapsed and other family signed up for Club 1. At this point I told the family that we had this evaluation with the club 2 team next week and we were waiting to decide until then. They were a little upset but not sure how we could have managed this better. I would love for them to get on this other team but I can't ask coaches to add another kid, it wasn't my invite/position anyway. 

I never intended for this situation to go this way, and wasn't fishing for an invite or trying to get special recommendation for our child on Club 2. 

AITA?",AmItheAsshole,UACEENGR,2,0.75,6,2025-04-23 20:11:25+00:00,Not the A-hole,https://www.reddit.com/r/AmItheAsshole/comments/1k692rt/aita_for_not_disclosing_club_team_opportunity_to/,True,Not the A-hole
