post_id,title,selftext,subreddit_name,author,score,upvote_ratio,num_comments,created_utc,flair,url,is_self,label
1jz3s9f,AITA for Wanting a Partial Refund on Shoes I Bought on Vinted Bc They Had Chewed Gum on the Bottom?,"I (40/F) have purchased some shoes for my daughter (1/F) on Vinted, which if you’re not in the UK is like Poshmark. I’ve had pretty good luck with infant and toddler clothes because kids often wear things 1-2 times before they outgrow them. 

Anyway, she’s starting to walk, so she now needs shoes with actual soles. I bought her a pair of converse online that were half the price of new ones. They didn’t look like they had been worn more than 1-2 times and were listed in very good condition, no photo of the soles and no mention of the gum (just adding that on sites like this, listing imperfections is expected so you can make an informed decision).

When I got the shoes, there was a big chunk of dried, chewed gum on the bottom as though the previous child had stepped in it, but everything else was fine. I started to try to remove it and got some off, then remembered to snap a photo. I looked at the listing again, and there was no mention of it and no photo of the soles.  

I requested a full refund by accident and the seller then responded saying she wanted the shoes back. I told her I was sorry and that I wanted to keep them and don’t think a full refund is warranted, but £5 or so would do as I paid £20 shipped. 

She responded telling me she was shocked I would ask for any money off and if I want to keep them, it can’t be that bad. She said it was “a little something sticky” and that if I don’t like it, I can send them back to her and she’ll find someone who will appreciate them. 

I’ve gotten quite frustrated because Vinted keeps telling me to click a button I literally cannot find in order to report that we can’t agree. 

My husband (35/m) told me that it was just gum on a shoe and not to get so worked up. Like, I know people are dying, etc., but AITA? Should this be expected? I’ve had a lot of luck here first year with stuff on there and never had something like this happen. 
",AmItheAsshole,LowerPresence9147,0,0.41,44,2025-04-14 16:54:36+00:00,No A-holes here,https://www.reddit.com/r/AmItheAsshole/comments/1jz3s9f/aita_for_wanting_a_partial_refund_on_shoes_i/,True,No A-holes here
1jyxe3w,"AITA for being mad that my 4 y old daughter calls her stepmom ""mom"" instead of her name","So my daughters dad, lets call him Samuel (m35), has been with his girlfriend Monica (f40) for about 1,5 years now. I (f31) have been with my boyfriend Michael (m34) for about a year. We have my daughter with us for a week and then shes at her dads place for a week. 

My daughter (Stephanie f4) has hintet on that she wants to call Michael dad, but weve told her that he loves her alot but hes still just Michael, out of respect for her real dad Samuel. 

Last month we had her 2 weeks straight because Samuel was sick. Stephanie said she misses her dad so i called him on videochat so she could talk to him. She talked with him and suddenly she said ""wheres mom?"" I was right infront of her on the sofa so i was confused, and then Monica came on the screen and said ""hey sweetie!"". 

I said ""Stephanie, shes not mom, shes Monica!"". They didnt say anything and i forgot about it, until we were invited on a birthday where Samuel and Monica were also invited to. I wrote to them on a groupchat we have between us ""parents"". Monica said that stephanie has herself decided to call her mom, and she is not ashamed of it because Stephanie is a lovely kiddo and she feels shes her own kid. I replied that its disrespectful to me to facilitate that, and Samuel told me to call a psychologist if i have some issues with it. 

Sorry this got kinda long

Tl;dr: my 4 year old daughter calls her stepmom mom, instead of her name

AITA for being upset about this?

",AmItheAsshole,krista111111111,137,0.69,288,2025-04-14 12:16:04+00:00,No A-holes here,https://www.reddit.com/r/AmItheAsshole/comments/1jyxe3w/aita_for_being_mad_that_my_4_y_old_daughter_calls/,True,No A-holes here
1jyrnnl,AITA for shouting at a taxi driver?,"Me (22F) and three other friends from university (Emma, Celine and Jesslyn, all 22-23F) went to an amusement park together. We decided to take a taxi back afterwards, and went to the taxi stand to queue up.

  
A taxi arrived, and Jesslyn walked over to the front passenger seat, while the other three of us slid in from the driver's side (the right side, as our country is a right-hand drive). We had a few bags, so it took some time. Once Jesslyn got in and shut the front passenger door, the driver started preparing to leave, and moved forward maybe 20-30cm. However, Celine had one foot in the taxi and one foot still out, and I hadn't even gotten in yet. Celine screamed when the taxi moved and the driver stopped, turned and said, 'Oh sorry, I didn't realize you guys hadn't all gotten on yet. I wasn't paying attention' or something to that extent.

  
I shouted at the driver, saying that it was irresponsible of him to drive off when not all of us had gotten on, that Celine could have gotten injured, and that I would never get on such a dangerous driver's taxi. Celine told me to stop it and get on, but I said that I didn't want to risk a road accident because the driver didn't 'pay attention'. The security guard came over and apologized, told us to get off, asked the taxi driver to leave, and ushered us to another taxi.

  
On the way back, Celine and Emma were telling me that I should have just gotten on the taxi because it was a genuine mistake and Celine wasn't injured anyway, that I was being mean for shouting at the poor taxi driver and wasted his time, and that we could all just laugh it off as a funny incident. I said that it wouldn't be a funny incident if we all died in a car crash, and no one said anything. AITA? ",AmItheAsshole,Mission-Box-7331,0,0.44,18,2025-04-14 05:44:37+00:00,No A-holes here,https://www.reddit.com/r/AmItheAsshole/comments/1jyrnnl/aita_for_shouting_at_a_taxi_driver/,True,No A-holes here
1jyhtxt,AITA for ignoring my little brother's demands?,"I (25F) live with my aunt and uncle and their two kids (15F, 3M). My aunt us in the middle of changing jobs, and has been helping her boss-to-be clean up her workplace in preparation for the summer kids, and my 15yo sister is helping her boyfriend at a wrestling show. So, I was in charge of the 3yo for today. He was hungry and so was I, so I made hotdogs for myself and prepared cheese, oranges and an Uncrustable for the kid.

When we eat at the table we all wait until everyone is served to eat. I had my brother drag the highchair to the table (it's light and he can easily push it) while I made the food. I got him situated and gave him his water while he waits because we want him to work on his abismal patience level.

While I was cutting up his sandwich he started banging on the table yelling ""Mine!"" ""Now!"" and ""Eat!"". I told him no and that he would wait until his lunch was ready. He kept yelling so I ignored him and brought our plates out once they were ready. He has a silicone plate that we suction cup to the table when we all eat together, and several times while I was trying to eat my own food he tried to pick his plate up from the table and play with it, so I had to stop what I was doing to put it back down, which made him yell ""No, mine!"" every single time.

When we finished he was huffing and puffing because gods forbid he couldn't have his way. He's not spoiled by any means, but he is very impatient and is in occupational therapy for his listening skills, hand-eye coordination and motor skills. His therapist is helping with him learning he has to wait sometimes, which is taking some time obviously.

But was I the asshole for ignoring a demanding toddler and essentially forcing him to wait for his meal?",AmItheAsshole,Euphoric-Paper-4512,122,0.77,46,2025-04-13 20:56:15+00:00,No A-holes here,https://www.reddit.com/r/AmItheAsshole/comments/1jyhtxt/aita_for_ignoring_my_little_brothers_demands/,True,No A-holes here
1jygdew,AITA Interrupting a spouse,"I (like most married couples) was having an argument, specifically about interrupting people. I was told during this that my words are being heard and appreciated, but they understand they ""always"" interject during my work phone calls and in standard conversation. I said ""no"" and was immediately accosted with accusations of how I don't think they feel like they interrupt and interject in situations I've asked them to refrain from. All of this to try and say "" no, you don't always interrupt me"". How do you even have a productive conversation at that point? Am I wrong/an asshole in thinking they're proving the point of what I hadn't even said?",AmItheAsshole,Responsible_Walk_681,0,0.37,30,2025-04-13 19:52:16+00:00,No A-holes here,https://www.reddit.com/r/AmItheAsshole/comments/1jygdew/aita_interrupting_a_spouse/,True,No A-holes here
1jy0qe5,AITA for jokingly saying I'm a gold digger,"English is not my first language,so please forgive me for grammar issues.

Me and my wife run a business,it's nothing big,but it has been able to provide a good life for us,so much so that we recently bought a sports car. The thing is,our business is technically my wife's,a friend of ours once suggested to us when we were starting up to register it in wife's name as a female being the owner comes with some advantages. So we did it. One day,we were out in our sports car,I was driving,a boy came to us with a camera and was apparently following that trend where people with nice cars are asked what do they do for a living,I jokingly told him that I am a gold digger and live on my wife's money,my wife,who was sitting beside me became angry at me due to this and is saying I shouldn't have said that,however,I think it's just a joke and shouldn't be taken seriously. So reddit,AITA",AmItheAsshole,throwaway0pop9,2,0.55,18,2025-04-13 05:44:51+00:00,No A-holes here,https://www.reddit.com/r/AmItheAsshole/comments/1jy0qe5/aita_for_jokingly_saying_im_a_gold_digger/,True,No A-holes here
1k6fy1x,AITA for offering to buy my friend drinks and study,"For context, I (18F) and D (19F) have been friends since sophomore year of high school. Among me and my close friends, it’s kind of become a tradition to share locations—it’s not a big deal, more like a trust thing. D and I had each other’s locations, but she got paranoid that I was “stalking her” after I mentioned that I’ll sometimes check if she’s in class before asking to hang out. I’ve only done this maybe once, but I get why that might feel weird. I told her she didn’t have to share her location and that I rarely check it anyway.

Two days ago, I asked D to study with me and even offered to buy us Starbucks since she was low on flex (meal plan money). I called her, got no answer, and left a voicemail jokingly saying “b!tch how come you ain't answering me.” This is clearly a joke between us—I’d never swear at her seriously. She had texted me “I’m in class,” so I just texted her my plans and waited for a response.

After a while, I realized her class would’ve ended based on the schedule I know. Since she used class as the reason earlier, I asked why she was ignoring me—yeah, maybe that’s an overstep, but we’re super close and it felt off. Plus, she gets super mad when *I* don’t respond, so it felt like a double standard. All I wanted was a simple “oh sorry I made plans with other people” so I could make other plans too.

Her response? “I'm turning my f*cking location off I'm with people stfu.” That really upset me. She hasn’t been acting like a good friend lately, and since she joined this bigger friend group, it feels like she treats me as disposable. Normally I’d let something like this go, but this time I called her out. I told her I knew she was out of class based on the block times and said her response was rude and embarrassing—especially considering she thought she was so special that I’d check her location like that.

She tried to defend herself by saying I was $h!+ talking her in my voicemail and was mad I cursed. But based on the tone, what I said, and the fact that she’s laughed at stuff like this before, I *do not* believe that’s really what upset her. I then sent her a long message—about 7 paragraphs—explaining everything that’s been bothering me about our friendship lately. Her only reply was one sentence: she was sorry she snapped and misinterpreted my voicemail. She completely ignored everything else I said.

I called her out again, but what hurts more is the idea that if she hadn’t “misinterpreted” my voicemail, would she have even responded at all? Or did she only reply to tell me to F off?

EDIT: She said “I’m in class” as to why she couldn’t answer my calls so that’s why I texted. Based on the class schedule I knew it ended in ten minutes and we are VERY CLOSE so when she was ignoring me I knew something was up so I asked. That’s when she flipped out and turned location off",AmItheAsshole,LavenderLeaf24,7,0.82,32,2025-04-24 01:20:10+00:00,Asshole,https://www.reddit.com/r/AmItheAsshole/comments/1k6fy1x/aita_for_offering_to_buy_my_friend_drinks_and/,True,Asshole
1k6f02g,AITA for placing my carry-on bag in an overhead compartment for a row I wasn’t sitting in?,"I (30 M) was on a flight the other day and my seat was all the way in the back- row 42. While I was boarding the plane, I placed my carry on bag in the overhead compartment for row 27 on the way back to my seat. I figure this isn’t a big deal as it’s first come first serve with overhead space and I saw open space where my bag would fit just fine. For context, I truly don’t believe your seat assignment also applies to open overhead space. I see overhead space as more so communal.

However, a middle aged guy (56?M) was already sitting in row 27 (the whole row was already seated by the way) and wasn’t happy that I was doing this. This guy was being passive aggressive saying “this is row 27.” He was more or less insinuating that I wasn’t aware of this and my carry on had no business being placed above his row. 

I didn’t think much of it and just carried on as this guy doesn’t own the plane and I believe it really doesn’t matter where you place your carry on as the overhead space is not assigned like a seat is. 

Fast forward to deboarding the plane, I go to row 27 to get my carry on and notice the compartment is already closed. I figure the same guy who was being passive aggressive about me placing my carry on in this row was still salty. This was his way of trying to teach me a lesson by closing the compartment even though my luggage was still in there. AITA?

",AmItheAsshole,SmallEntertainment1,0,0.38,77,2025-04-24 00:32:16+00:00,Asshole,https://www.reddit.com/r/AmItheAsshole/comments/1k6f02g/aita_for_placing_my_carryon_bag_in_an_overhead/,True,Asshole
1k6ejuh,WIBTA? My brother accidentally sent money to the wrong Zelle account,"Hello! First time posting and wasn't sure how to tag the title, looking for some clarity in an odd situation. Long story shorter my brother has diamond status at Caesars so he gets really good discounts on rooms at their properties. He offered to help me book a room for a trip in June, was saving me like $300-$400 on a 5 night stay which was awesome! We had to put down a refundable deposit on the room of $230. Had him book it and sent him the depo money through Zelle.

I had to rearrange this trip and had to cancel that booking which no big deal because the deposit is refundable. He got the refund and said he sent me the money through Zelle. I check the next morning and don't see a deposit back, check through alerts and whatnot, nothing. I text him to ask and he sends me the receipt for the transfer. Somehow he sent it to my old work phone number. I haven't had that number in 3+ years and don't know how he even has it because I've had the same personal cell number for like 12 years but that's what was in his Zelle contact which is weird because the last like dozen plus times I've sent him money has been through Zelle from my current phone number and account. You can't reverse a Zelle transaction at all, it's gone once you send it. I tried calling the person he sent it to, left a vm but I'm obviously not very hopeful of getting it back from a random who doesnt even have their name in their VM. He's saying it's my fault for not letting him know I don't have that number any more. WHAT??? I told him that i get it, mistakes happen and ask him to split it with me, he said no. We're both mid 30's and make $200k+ so the $230 or $115 doesn't really affect either us. For me it's just the principal of it, he literally threw the money away, is blaming me for it and won't even split it with me. On the other hand he was trying to help me out by saving money on a room booking. We were never close growing up but when we got into our mid 20's we finally got over that and became friends. I stay at his house when I'm in his town and etc so I don't want to make a big deal out of this but WIBTA if push him to make things right? How am I supposed to know to tell him I don't have this old phone number when I have no idea why he has it? We don't ever talk or text on that number, I'm at a loss on that. Do i just eat it and move on? I'm irritated as hell lol",AmItheAsshole,IndependentPutrid564,8,0.7,17,2025-04-24 00:09:50+00:00,Asshole,https://www.reddit.com/r/AmItheAsshole/comments/1k6ejuh/wibta_my_brother_accidentally_sent_money_to_the/,True,Asshole
1k6d8jb,"AITA for pointing out the danger in his ""funny story""?","My mother and I babysit my niece Luna (3), and have babysat since she was born. I've always been there and I've always gone out of my way to help

Today we went to babysit and my brother in law Jake started to tell a ""funny story""  from earlier in the day. The story was, "" I was in the kitchen making my self lunch and Luna was by herself in the living room. I got done making my food and went and sat down with her and after a little while I noticed her messing with her nose, so I started looking and she has a whole sucker wrapper stuck in there. I couldn't get it out so I called Kat (Luna's mom, my sister). She came home from work with a medical balloon to get it out."" And that was it.

I do not like Jake, he's been careless with Luna multiple times by being careless.

I was so upset so I got up and walked away. I ended up just washing my hands mumbling under my breath ""or just watch your fucking kid, its not that hard."" I really didn't think he heard this part but idk. My niece is trying to get me back to the living room where him and my mom are talking about it. I go with her hoping they'll change the subject. They're still on it, he's chuckling, my mom's nodding, she's either on the same page as me, or she can tell I'm about to speak up, I look at him blank faced and tell him "" That's really dangerous dude what if it was a magnet or a battery or something?""  And then silence. Eventually Luna breaks the silence and he ends up leaving for work.

Kat gets home and instantly starts shit. She says something similar has happen under my mom's watch, I say that that was a bead that could easily slip into her nose, not a candy wrapper she'd have to spend a good period of time shoving up there, and that my mom was watching when it happened, it just happened too fast. She's real heated and is raising her voice louder in front of Luna saying, "" How long do you think it take to cook, clean, shit-"" I cut her off just saying ""How long does it take a baby to die?"" She then starts fully yelling, "" You need to stop disrespecting out parenting were both basically single parents if you don't like how i'm raising my daughter then you cant leave and not come back just stop coming over.""

Edit/ update: Cannot delete post yet, so I took stuff that everyone was focused on instead of the actual AITA. I grew up with a stoner parent and thats not the dangerous part, his being a dumbass is. After talking to my mom I learned Kat said same thing happened with my mom, but my mom gave her something with beads that broke while Jake was supposed to be watching. And Jake was laughing so much because he was scared my mom would ripe him a new one. Calling cps is not something I'd even consider.

AITA for saying something to Jake?",AmItheAsshole,Rare-Succotash9053,14,0.75,30,2025-04-23 23:08:05+00:00,Asshole,https://www.reddit.com/r/AmItheAsshole/comments/1k6d8jb/aita_for_pointing_out_the_danger_in_his_funny/,True,Asshole
1k6csvh,AITA ex wife addition,"Aita?? My husband was married before and had two children with his first wife. We have been married for 7 years and have two young kids of our own. He shares 50-50 custody with his ex-wife of their two sons and They live with us half the week and have been since they were 3 and 4 years old. They are now 12 and 14 years old and their mother had two kids with her second husband. The divorce was very bitter and dont have a good coparenting relationship. Even after all these years, it still gets very nasty between them and it's something that will never change. When I was in the hospital, giving birth to our first son she refused to take her two sons our custody days being I was in the hospital, giving birth. No reason given, she went against their settlement agreement that if one of the parents can't exercise their parenting time due to an emergency the other parent takes the kids. She refused her two sons during the time I was in the hospital Putting my husband in a very tough situation. Fast-forward, she does not recognize my two sons. ever. She doesnt acknowledge them or speak to them if at same event. To be fair, she doesn't speak to me either. My husband is genuinely a nice guy, but also has a lot of insecurity from that marriage. She's a dominant personality, was the breadwinner, put him down a lot. Whenever he sees her two kids he's always very polite and says hello. Which is fine. But do you think he should go out of his way for them? For example, we were all at the same event and one of her children was having a tantrum. My husband happened to be there and witnessed the tantrum and being the nice guy he is said if you stop crying, I'll give you a ride in the golf cart around the field where they were watching The older boys play a game. He tells me the story later on to which I didn't have much to say. he asked why I was quiet and I just thought it was unnecessary to take the kids on a golf cart ride being that she is disrespectful and doesn't acknowledge our two younger sons. To put in reference our kids are 3 and 4 and hers are 4. I told my husband you do you. But she has disrespected our family and doesnt acknowledge our 2 sons so I wouldnt go out of my way for hers. He thinks I'm being ridiculous and that their children and nothing to do With the issues that are already there. I agree and just wave and say hi but that's it. My loyalty is to my children.in my husband's mind those two boys are his son's half brothers which means family and he wants his kids and those kids to see that he's a good guy and can put differences aside. Am I wrong? Is he right? I realize there may be no right or wrong. And I told him tha.",AmItheAsshole,Haunting-Formal-8130,0,0.37,157,2025-04-23 22:48:29+00:00,Asshole,https://www.reddit.com/r/AmItheAsshole/comments/1k6csvh/aita_ex_wife_addition/,True,Asshole
1k6crxj,"WIBTA if I gave my sibling the ""worse"" version of a gift I'm making?","Hey, y'all, I need an outside opinion. My younger siblings are graduating high school next month, and due to my chronic illnesses, I'm unable to attend their graduation. I'm proud of them both and wish I could be there, but the ceremony starts at 7pm and I wouldn't be able to make it through without getting really sick.

I'm a crocheter, so I'm making them little graduation cap pins to wear on their graduation night. Honestly, there isn't much of a difference in the quality of the crochet caps--they're well made, the embroidery is neat, and I've been crocheting for five years so I trust my skills. The only thing is that it's a new pattern I'm designing, so I'm making little changes here and there as I go. For the record, I did a test of the pattern first and I have never made pins before. The actual pin part is a first for me.

The younger twin, ""Skye"", has been fighting with our youngest sibling (12) for months, and the fighting is getting on my nerves. Maybe I'm being petty, but WIBTA if I intentionally gave Skye a slightly less polished version of the pin?

Edit: Thanks for the feedback, y'all. I love making things for people and came to Reddit because I felt weird about my feelings on this one. I'm going to do it randomly, and whatever happens will happen.",AmItheAsshole,TokenLovelessAroallo,9,0.69,12,2025-04-23 22:47:19+00:00,Asshole,https://www.reddit.com/r/AmItheAsshole/comments/1k6crxj/wibta_if_i_gave_my_sibling_the_worse_version_of_a/,True,Asshole
