post_id,title,selftext,subreddit_name,author,score,upvote_ratio,num_comments,created_utc,flair,url,is_self,label
1k68atw,AITA for getting my friend a scholarship in his dream school ?,"I’m 18M. Back in high school, I had a fallout with my original group of friends, and a new group slowly formed. That’s when I got close to a guy, let’s call him P. We bonded over preparing for a competitive exam (India), and even had the same exam center. On the way there, he wouldn’t stop talking, and it was frustrating—especially since it was a big day. My dad, in our native language (which P doesn’t understand), started swearing at him to keep quiet and focus. That car ride messed with both our focus. I missed the cutoff by a few marks, and P didn’t clear it either.

When we got home, my dad told me P was a distraction and a leech. But I ignored it. Later, I got into my dream school and he didn’t. He started whining about how a “superior” student like him didn’t get in, but I did. I let it slide—it sounded like something said in the heat of the moment.

I even helped him apply to a school in Delhi. I literally helped him build his whole application. He ended up getting a scholarship thanks to me too. (I had reached the final round of a competition and pulled some strings with the organizers to get our friend group in, including him. He used MY work  everything from the ppt to the final word doc in the application and landed the scholarship.)

Fast forward, I got a 100% scholarship to another college by the same founders. P downplayed it, saying they were “handing them out like candy” and that it wasn’t real. Again, I brushed it off. That’s just how he was sometimes.

Then college started. He ghosted our whole friend group and left all our WhatsApp groups. He even blocked me on Instagram. I thought, maybe he’s just moving on. But then I heard he came back to town a few times and met up with everyone—except me.

Then I had a near-death accident. My therapist encouraged me to reconnect with people important to me. So, I reached out to him. He said he felt like I always blamed him, that I pushed him around, and that he chose his peace. It felt like betrayal.

I lashed out. I said he was just a replacement for my old friend group, called him arrogant, ungrateful, and reminded him I helped him get that scholarship. I said he never checked up on me when I was hospitalized, and that he distracted me at a major turning point in my life.

He told me I was ego-driven, always seeking attention, and that he didn’t owe me any explanation. He “chose peace” and ended the friendship.

My friends and girlfriend say I should move on—that he’s not worth it. But he used to be a good friend before college. I still miss who he was, and a part of me wants him back in my life.

So… AITA for lashing out at him? Should I try to fix things or just let go?",AmItheAsshole,ammmmmmmmdaaaaaaa,0,0.43,11,2025-04-23 19:39:51+00:00,Everyone Sucks,https://www.reddit.com/r/AmItheAsshole/comments/1k68atw/aita_for_getting_my_friend_a_scholarship_in_his/,True,Everyone Sucks
1k5umj6,WIBTA for not Attending a Wedding where my wife was excluded from the bachelorette party?,"WIBTA? Wife is excluded from Bachelorette Party, I'm planning on skipping wedding and telling off the in-laws

Honestly, my wife (and I) are almost always excluded from family activities or outings in one way or another.
My wife is literally the sweetest woman on Earth, (puts up with me), and has always been incredibly kind and patient as long as I've known her.
We flew into town from out of state for her brothers wedding this Friday. Last night we had over her soon-to-be SIL, all of her siblings that were able to make it, and her other brother's fiancee. That other fiancee and her two sisters were talking about going to Target tomorrow... To buy the new SIL a gift for her bachelorette party on Thursday. We were shocked. We came from out of state, and assumed since we hadn't heard anything that she had already had it before we got there, (which would have been fine and understandable,) but now it turns out that my wife, his oldest sister, wasn't invited, but the other two sisters, (one 26F and the other 17F), AS WELL as the other brother's fiancee, are all going.

Not a WORD has been said to my wife about her being invited. When it got brought up, the two sisters acted like they got caught or something, didn't offer any consoling words, and changed the subject to my wife's health and how her kidneys are getting worse. 🤦🏼‍♂️🤦🏼‍♂️🤦🏼‍♂️

So, what do you think? Am I overreacting to not go to the wedding after all, tell off my in-law for being jerks to my wife her whole life, and possibly stop coming to family events?",AmItheAsshole,Due-Guarantee103,590,0.8,368,2025-04-23 09:08:16+00:00,Everyone Sucks,https://www.reddit.com/r/AmItheAsshole/comments/1k5umj6/wibta_for_not_attending_a_wedding_where_my_wife/,True,Everyone Sucks
1k5ima4,WIBTA if I took my moms dog while she’s in rehab and didn’t give him back,"Context: I (31F) am 100% no contact with my mom (50F). She’s narcissistic, abusive emotionally, verbally and formerly physically. I tried low contact, I tried to “mend fences” but a whole childhood of abuse from her to me, and lying about her use of scripts finally took its toll a little over a year ago. Everything is transactional with her, and it’s completely exhausting. I’ve paid her bills, I’ve given her a car that she wrecked because she was high, and for months and months I drove her everywhere. My final straw was when I worked a 9 hour day; picked my four kids up, then had to drive her around for five hours for errands - hadn’t even fed my kids dinner yet - and she bitched me out for not stopping so she could buy Mexican food. While she was high. I refused to stop because I knew by the next week she’d be begging me for money. I ripped her a new one all the way to her house, apologized to her husband (33M) for what I was leaving him with, and haven’t seen her since. Full blockage, him and her. 
Well, she recently called the police on her husband and accused him of beating on her. From what I understand, they let him go when he was able to prove that she fell while high. So he’s gone. She is completely alone with her 2 dogs, a pitbull and a mastiff that WAS MINE but she never gave back after I had my daughter in 2019 when she dogsat. He was well taken care of, loved, and spoiled so I didn’t fight too hard. I still saw him regularly, until this past year. I’ve been trying to get him back without having to deal with her and hadn’t really found a way. Wellllll, long story short, because she kicked her husband out the way he did and he isn’t coming back, she’s gone off the deep end according to my brother and has started mixing her pills again and been a danger to herself. He’s trying to have her committed/sent to rehab - I’m not entirely sure and to be frank, I do not care. What I DO care about is my dog. The pitbull has bit my child twice so I refuse to deal with her, my brother can find someone else or she can be put down if the shelter won’t take her. I know that’s callous, and it’s not the breed I have a problem with it’s THAT PARTICULAR DOG. But there’s NO ONE around here who are family or friends, not even my brother he’s 700 miles away. Just me. But for “my” dog, the mastiff, I want to take him back and I wouldn’t give him back when she’s released. She’s unstable (rehab and mental health help will only last a month at best in my experience), has an unstable living environment (eviction pending), and has no money for the vet care that he’s going to need as he ages. I’m pretty sure the last time he saw a vet was when I took him in 2019. Meanwhile, my husband and I both have full time jobs that pay fairly well, we own our home and a yard, and have a vet we know and love. WIBTA if she does end up “away” that I take him back and not give him to her when she’s released? Would it be wrong to upheave his life like that? 


To clarify- I have been asked to take care of both dogs at her home. That would entail driving an hour each direction 3x a day. I am unwilling and unable to do that. I would take the mastiff to my home, and my brother would need to find alternate arrangements for the pitbull until her release. ",AmItheAsshole,Fabulous-Drive-9911,13,0.74,11,2025-04-22 21:49:47+00:00,Everyone Sucks,https://www.reddit.com/r/AmItheAsshole/comments/1k5ima4/wibta_if_i_took_my_moms_dog_while_shes_in_rehab/,True,Everyone Sucks
1k5ejec,AITA for saying her cats shouldn’t have full access to the house?,"I'm in the process of buying a house with my fianceé, but I'm traumatized as to how unwholesome her fuzz riddled home is (1 bedroom apt and 2 cats). 

**The thing is, I'm allergic. I'm severely allergic to cats.** I have to take an allegra every time I go to her place, otherwise my face gets swollen, my eyes gets watery, and I get an unbearable amount of sneezing. Whenever I sleep there, the cats will walk on my face during the night and I'll wake up to a miserable next day. 

**She knew that, we were together for years, and still she adopted a cat.** Back then she put me against the wall, talking about how much she always wanted one, how lonely she was during the week, and ended up nudging me to accept it. After a while, on a whim, she got the 2nd one without even talking to me first. I didn't love the idea, we fought, but in the end I wasn't about to end a healthy relationship because of a cat, so I tried to bear with it. Now we're talking about marriage and we're on the process of buying a home, but I don't wanna live the rest of my life on daily allergy medication, with terrible breathing and overall welfare. 

At first I proposed the cats to be strictly outdoors. We could put safety nets around the property perimeter and let them live outdoors with my dog. She DID NOT agree. I folded, and further proposed the cats to be restricted only to the ground floor, not being allowed upstairs to the bedrooms. This is where we're at now, and again, she does not agree.

***The cats must have access to the whole house, and if they like, they'll sleep with us.*** 

Accordingly to her, ""her cats are her companions"", ""they always slept with her"", ""I AGREED WITH HER GETTING CATS BACK THEN"" (?) (she guilt-tripped me into agreeing with one, back then). 

Now I'm feeling pretty f\_cking miserable over considering breaking up a marriage over a f\_cking cat. I'd love not having this medical condition, but it's beyond my control. I'm not about to rationally choose to live a miserable life in a furpocalypse, sleeping in a shedquarters, never again owning a proper black pair of pants because she gaslit me into accepting them. 

AITA here?",AmItheAsshole,Jarbous-Fan-8781,858,0.78,1061,2025-04-22 19:02:54+00:00,Everyone Sucks,https://www.reddit.com/r/AmItheAsshole/comments/1k5ejec/aita_for_saying_her_cats_shouldnt_have_full/,True,Everyone Sucks
1k5dgks,AITA for calling my MIL a narcissist?,"To start: I never told my MIL this to her face. 

My husband and I were having a discussion about how hurt I was from the externally hurtful comments his mother made to me during our wedding. When I stated, “She’s ✨acting like✨ a narcissist“.

Very recently, I was speaking with MIL on the phone, when out of the blue she listed off reasons why she no longer speaks to me. One of them, “You called me a narcissist!” 
(I knew right there and then, that my husband told her of what we talked about in confidence)

MIL went on, to explain that she had all of these plans put in place for when I would come and visit… but now that she has learned this, she has canceled everything. 

Even to go on and strongly suggest we get a divorce.
“ I’m telling you this as a woman, and not as his mother… But you guys really need a divorce.” - MIL


",AmItheAsshole,Anonymous-Wifey,37,0.91,35,2025-04-22 18:20:49+00:00,Everyone Sucks,https://www.reddit.com/r/AmItheAsshole/comments/1k5dgks/aita_for_calling_my_mil_a_narcissist/,True,Everyone Sucks
1k5dfed,WIBTA for getting an anti-bark device for my neighbors dogs?,"I(27f) moved into my house about 5 months ago. My neighbor(60ish f) has 3 small dogs that bark constantly. If they see me in my living room, they bark. Anything interesting in the yard - bark. Want in? - bark. If I am working in the yard, they come out and bark at me, doing it on and off for the duration of me using my yard. I'm sure if I had people over outside, they would never shut up. It's annoying and defining. 

I haven't had a conversation with her about it, but she seems to let them bark at her constantly and the classic doesn't bother to train a small dog. I'm doubtful a conversation would go anywhere, but you never know. 

Here is the alternative I have been contemplating... They make anti bark devices that sense barking and will emit a high pitch noise that dogs hate. I could buy one of these and position it at her yard. The reason to not have a conversation before getting one of these is I think she would be less likely to suspect it when her dogs start acting funny. Also, I think it's common sense to not let your dogs bark at someone in their own backyard, so not sure what a conversation will do... But you know what they say about common sense. 

So what do you think - would I be the asshole for getting one of these devices And using it on my neighbor's yard without trying to have a conversation first? 

Edit: the noise is ultrasonic, so only dogs can hear it, not humans. They are somewhat commonly used for dog training, and do not add noise to the neighborhood. Also, I fixed a couple minor typos above. ",AmItheAsshole,Regular_Nobody6084,2,0.51,113,2025-04-22 18:19:32+00:00,Everyone Sucks,https://www.reddit.com/r/AmItheAsshole/comments/1k5dfed/wibta_for_getting_an_antibark_device_for_my/,True,Everyone Sucks
1k5bzk1,AITA For bringing food to my friend's party?,"Right so I've got this friend I'll call Steve who is a great friend but not a great host in some aspects. He throws parties which are fun and enjoyable save for one problem that arises literally every time. There is never enough food.

For example, he had a game night and there were 10 people other than him and his wife there. He ordered 2 large pizzas and one small specialty pizza (this was from Dominos if you're curious about the size). For sides there was an order of garlic knots or something like that. So the party was fun, but after a couple hours I was hungry again/still and overheard another couple talking about getting food on their way home.

The next time there was a get together I offered to have me and my wife bring a dish, but he insisted he had food covered. We show up and again, there's only enough for everyone to have one serving of the pasta he made. It really wasn't enough.

I don't think it's a matter of cheapness, because the problem is only for food not for drinks, he happily shares his extensive liquor cabinet and always buys plenty of beer and wine. He also always happily brings dishes for potlucks at other houses.

For the next get together at his house I pitched the idea of a potluck, some other friends also signed on to the idea. I'm sure you can see where this is going. Then New Years Eve he hosted and we ran out of snacks before midnight and a couple of people ended up dipping to go to another party. He seemed annoyed but I don't think he made the connection.

So finally last weekend he was hosting again and rather than ask, I decided I would just bring a dish and some snacks. He was visibly annoyed but didn't say anything about it, he was just short and avoided me for most of the evening. The next day he texted me saying it was rude to bring food to someone else's house like that. I apologized and said I was just trying to be helpful and reminded him about how food had run out at previous get togethers and I was just trying to help avoid that. He got mad and accused me of saying he's a bad host. I told him I didn't think that was true at all, just that his food estimation abilities needed some work and that leftovers aren't a bad thing.

He didn't respond and hasn't responded to any of my messages since.",AmItheAsshole,BellPerfect1504,1627,0.96,282,2025-04-22 17:22:20+00:00,Everyone Sucks,https://www.reddit.com/r/AmItheAsshole/comments/1k5bzk1/aita_for_bringing_food_to_my_friends_party/,True,Everyone Sucks
1k4s4ef,AITA for making my ex delete all his socials because he wanted to play the same childish game?,"okay so me (18f) and my ex (18m) were only dating for a couple of months id suppose? june-october 2024 and those werent fun months, we had our differences and opinions. we weren’t compatible whatsoever, we ended things amicably in oct, and ig we stayed friends well.. tried to stay ‘friends’ that really didnt work out until he recognized it in march of this year, and found out he deleted his other socials like DC and IG, he made new accounts ig?? thats cool i dont care honestly, his life his choices right?
but, heres the stupid thing.
he’d play this dumb game like block me, unblock me say something to me thats offensive or get under my skin, block me. rinse and repeat.
i played the same game only for two days though.. then found out he deleted EVERYTHING. changed his number, snapchat, facebook you name it.
idk i told people about that situation and they all think i went too far?
i wouldn’t say anything mean imo, just make new accounts and say something silly for

ex:
▶︎ •၊၊||၊|။||||| 5:16 
pooping audio


but he’d go all out and say some gruesome things to me idk why ig he got all sissy or something. but i really just want to know if im the AH about this whole situation?


edit: i did forget to mention he made new account(s) /number(s) to text me a few months back.
(this also happened at least a couple weeks ago, like late march or early april)",AmItheAsshole,Parking-Chocolate187,0,0.39,9,2025-04-21 23:37:35+00:00,Everyone Sucks,https://www.reddit.com/r/AmItheAsshole/comments/1k4s4ef/aita_for_making_my_ex_delete_all_his_socials/,True,Everyone Sucks
1k4io6n,WIBTA for telling my fiancés parents his financial crisis?,"I (29 F) am going to marry my fiancé (31 M) in 2 months.  We have been together for 5 years and I wouldn’t trade it for the world.  Recently our landlord mentioned that we will need to move at the end of our lease as they are going to be upgrading our unit.  Unfortunately, the end of our lease is 2 weeks after our wedding. I’m panicking as our wedding is coming up AND we have to move AND my fiancé will be in the middle of a career change. This is the most stressful and exciting time of our lives. We applied to our dream apartment, in a safe neighborhood with laundry in-unit and a balcony.  We currently live in not the safest neighborhood, our mail is stolen frequently, our laundry is 4 floors down without an elevator, and our kitchen is barely even a kitchen, so for 5 years I have been dreaming of living somewhere new, somewhere where we feel like we’ve leveled up in the world.  Well, it came to my attention that my fiancé has a terrible credit score and we got denied our dream apartment. I was and still am furious as my fiancé doesn’t understand how credit works. (I never asked him his credit as I figured he was doing well and we are adults, I didn’t think I would have to teach my fiancé about credit.) 

Because of his bad credit, we cannot find a place that will accept his credit which means I have no idea if we’re going to have a roof over our head after we get married.  My credit is strong but without his income I do not make 3x the amount of rent each month and hence, we can’t live in the area that we had been dreaming of.  

Our options are to find a cheap place in an area that we don’t want to be living in for another year while I patiently wait for his credit to build, or would I be the asshole if I went to his parents and asked them to put his name on one of their credit cards to increase his credit and help us solidify a place to live sooner rather than later.

My fiancé has a strong relationship with his parents and I realize that if I say something to his parents, he’ll feel less than and embarrassed about his situation.  

The only debt we have are school loans which is only a few thousand. Our cars are paid off, we don’t have any credit card debt.  So money is not an issue for us, he just has poor credit.  So WIBTA going to his parents for some guidance and help? I’m beyond stressed out, I haven’t been able to sleep and I need help asap. 


**edit**
Sorry I left out crucial information. We have both discussed in length about how he got into the position that he’s in.  He understands what he did to get himself in this situation and I can empathize. Yes, I absolutely learned valuable lessons myself and we both call moments like these AFGO moments (another f***ing growth opportunity). I asked him about talking to his parents so this would not be me going behind his back at all.  He would like to think about it for himself first, I just wanted to hear what others might think or have for advice?  

We BOTH learned valuable lessons and are going to be learning from them.  ",AmItheAsshole,Euphoric-Pass2727,41,0.83,99,2025-04-21 17:07:29+00:00,Everyone Sucks,https://www.reddit.com/r/AmItheAsshole/comments/1k4io6n/wibta_for_telling_my_fiancés_parents_his/,True,Everyone Sucks
1k4bay3,AITA for swearing at my sister's boyfriend after he falsely accused me of stealing?,"I (30m) recently moved out of my dad's house into my own apartment with my friend. My dad still lives with my brother, sister, and her boyfriend (38m) of 5 years. I moved out amicably over a variety of reasons.

I've been back to my dad's once every week to visit. This has gone pretty well – my sister and her boyfriend work third shift. It's mostly been visiting my dad and my brother. Everything was fine until last Friday.

My sister's boyfriend randomly asked me if I took any silverware. My dad has been to my place and is aware I have my own. After I say no, he says the silverware's disappeared recently, and I say I didn't take it. He then says, “Well the only variables are half the silverware's gone and you moved out.”

I exploded. My sister's boyfriend said something to the effect of “I'm just asking questions, I'm not accusing you of anything”, which didn't stop me. In my mind, after he said what he said, it turned into an accusation and a press. I said that if he really was asking questions he would've dropped it after my first no. He then went off about how someone must have thrown it out, and I pressed him about the accusation.

My dad stepped in, explained that I was innocent, and separated us. Eventually, our screaming woke my sister up and she yelled at us to be quiet. I explained the situation and she yelled at him. Every time he tried to defend or explain himself, I yelled back, which devolved into my sister yelling at us to “shut the fuck up so she can get some sleep before work”. My dad politely asked me to leave. Before I left, I scream “YOU WANNA ACCUSE ME OF FUCKING STEALING FROM MY OWN FUCKING FAMILY? FUCK YOU!” and left.

My brother was outside when this popped off, so I vented to him. Screaming, swearing, the whole nine yards. Specifically “fuck that motherfucking cunt,” among every name in the book. I said that I wish my sister left him when they had relationship troubles. He heard my rant. 

My brother tried to say that I was taking my sister's boyfriend out of context because he took back his accusation. We argued about that more civilly and I left.

After I got back to my apartment, I sent a text to my brother and my dad saying that I wouldn't be at Easter and that I wanted an apology from my sister's boyfriend. I apologized to my sister for waking her up and left it at that.

My sister's boyfriend wants an apology for swearing at him. My dad and brother think this is reasonable. In their eyes we both acted badly, two wrongs don't make a right, and that I wasn't justified in swearing at him. My brother doesn't think it was an accusation, and my dad thinks I'm overreacting. Because my sister's boyfriend took it back, it wasn't that bad.

My sister is fighting for me, and they've been fighting ever since. I told them I wasn't going to apologize for reacting to his smears and that he crossed the line. My dad and my brother are trying to keep the peace, which I'm disappointed in. 

There will be no peace until he apologizes.",AmItheAsshole,knownhatredcaster,1243,0.91,310,2025-04-21 11:34:31+00:00,Everyone Sucks,https://www.reddit.com/r/AmItheAsshole/comments/1k4bay3/aita_for_swearing_at_my_sisters_boyfriend_after/,True,Everyone Sucks
