post_id,title,selftext,subreddit_name,author,score,upvote_ratio,num_comments,created_utc,flair,url,is_self,label
1k5ps22,AITAH by telling my mom no more babysitting at our house after she did not respect our boundaries?,"I had a problem with my mom and brothers. My mom and my husband and me live in the same home. Me and my husband work and pay the bills and my mom is retired but got some money from the babysitting as spending money. My mom was babysitting my 2 neices and 1 nephew from 2 different brothers of mine. Brother 1’s kids (2 and 3yo) were not very disciplined kids and were rowdy and my brother would not pick them up in a timely manner or even let us know if he would be late. Initially we were ok with it but my husband started having mental health issues because he was coming home and my mom was stressed, the home was loud and he couldn’t relax. The kids wouldn’t leave until 7pm most days which didn’t allow us to get our home put together each night or feel like we could unwind after work. 

My brother 2 had only his daughter who was 14-17 months old at the time but she was quiet and listened most of the time and would be picked up by 4pm. me and my husband would get home around 5:30-6pm. Brother 2 was understanding of the issues and knew to be responsible with his daughter. 

After repeatedly asking my mom to build a boundary with brother 1 and her not doing it, my husband and I began having issues between us and my mom. We went through months of discussing and finding ways to accommodate like having them come at a certain time every day to pick up their kids like brother 2 did. However my mom would say she would do it and not follow through. The situation kept getting worse with my husband asking for a better solution as our stress levels and lack of relaxation was really getting to him. 

We had so many discussions with my mom and his fan together where she would say she would do as we asked but didn’t follow through. My mom said we didn’t like brother 1 and that’s why we were asking for the boundary. After several arguments we told my mom we didn’t want to have brother 1’s kids being babysat here she said ok but then they showed up a couple weeks later after she reassured me they weren’t coming anymore. This led to a huge argument between my husband and I. He was so fed up and told me no more babysitting for anyone. I told my brother 2 about this and he got upset and his wife did too. My mom went to his house after the argument and we’re not sure what she said but I did have a conversation about the situation with him the next days and it seemed he understood. Within a week  they told me I couldn’t spend time with any of their 3 kids and cut me off. 

Brother 1 has always been irresponsible and doesn’t think about consequences. Brother 2 is very responsible and knows boundaries without being told. They are about 2yrs apart and I’m 7 and 9 years younger than them. 

AITAH?",AmItheAsshole,Michelle23-,252,0.95,70,2025-04-23 03:41:50+00:00,Not the A-hole,https://www.reddit.com/r/AmItheAsshole/comments/1k5ps22/aitah_by_telling_my_mom_no_more_babysitting_at/,True,Not the A-hole
1k5pit1,AITAH for this? I genuinely have to explain!,"Me and my family have moved out of the US and have been gone for just about a year here in June. Although I love my wife, my MIL can be pretty estranged. Let me explain:

Before moving out of the US we legit lived 20 minutes up the road from her and she never wanted to really hang out or do much but complained that we didn’t see her often or invite her to things… everytime I offered to get drinks or some food with me she turned me down without hesitation…

Fast forward to last year she insisted that she 
should come visit us for the Christmas Break. We of course said yes! We thought it would be a grand ole time.

To summarise I’m just going to give a brief conclusion of her time here for that break:

-Stated she would pay for half of the Air BnB (she helped pick it and everything). Only gave us about $100 for a $1000 Air BnB. 
We never asked for our share.

-She literally complained about every single thing. We were a 5 minute walk from the beach. All you had to do was walk through a beautiful palm tree field and boom a beautiful beach. She never went alone and complained when we went as a family. We even went to some pretty good restaurants and still complaints. But she kept saying she was happy.

I could truly go on for days about how she acted during this trip that just didn’t align with her words at all. My wife even pulled her aside and asked if she was okay a couple of times because she noticed.
—
Fast forward to today. She is insisting that she has to come back to visit us. No problem. We said yes. But the issue at hand here is that she is complaining that we won’t allow her to fly in on the 15th when we aren’t off of work/school until the 20th. And it would be a lot easier for her to just fly directly to the place that we will be  staying at for our Christmas vacation rather than flying in on the 15th and having to road trip with us and having to squeeze in a tiny car…

AITAH for telling her no? We simply don’t want to spend those extra days with her because she spends most of her time alive just complaining and being negative all the time. We are just trying to be polite and blame it on our limited space.

(Too elaborate on the space. She over packs for things. My wife does as well. If you know anything about cars we drive a Mazda 2. I am 200cm tall.)

 ",AmItheAsshole,Important-Award7642,13,0.89,13,2025-04-23 03:27:33+00:00,Not the A-hole,https://www.reddit.com/r/AmItheAsshole/comments/1k5pit1/aitah_for_this_i_genuinely_have_to_explain/,True,Not the A-hole
1k5ovje,AITA por mentirle a mi papá sobre el dinero que tengo,"I am a bad person because my dad asked me for money because of a legal problem that he got into, and even though he was never present in my life or contributed a dollar throughout my childhood and youth, and my mom was the one who gave us everything I needed, I told him that I can only send him a little, even though I can provide him with the amount he needs to pay his legal debts. ",AmItheAsshole,Immediate-Judge-9596,0,0.45,7,2025-04-23 02:52:47+00:00,Not the A-hole,https://www.reddit.com/r/AmItheAsshole/comments/1k5ovje/aita_por_mentirle_a_mi_papá_sobre_el_dinero_que/,True,Not the A-hole
1k5olwo,AITA for not involving myself with my MIL when she complains about not having a relationship with us?,"My boyfriend and I have two young kids. His relationship with his mom (my MIL) has always been rocky. She and his dad divorced when he was in middle school, and after that things got worse between them. She struggled with a drinking and lying problem for years, and when they did speak, she’d never really focus on him—it was always gossip about others, never meaningful conversation or connection. That kind of negativity pushed him away even more.

Now as adults and parents, she still hasn’t really shown much interest or effort with our little family. She barely has a relationship with our children. We’ve asked her multiple times to babysit or spend time with the kids, and she always has an excuse as to why she can’t—yet she’s very present and involved with her other son’s kids. She watches them, posts about them, and spends time with them regularly. But with ours? She’s barely around. My 2-year-old didn’t even recognize her and hid behind my boyfriend’s legs when she came over once.

At the same time, she constantly complains to me about not having a relationship with our kids or with my boyfriend. She’s messaged me multiple times venting that she’s “so over” him, upset that he doesn’t show up to family events, doesn’t talk to her, or doesn’t reply to her messages. But honestly, how does she expect to rebuild a relationship when she’s done very little to repair the damage?

I’m honestly tired of the guilt trips and the emotional weight of trying to maintain this one-sided relationship. So—AITA for not putting more energy into this relationship?",AmItheAsshole,Purple-Contact-2203,36,0.92,21,2025-04-23 02:38:41+00:00,Not the A-hole,https://www.reddit.com/r/AmItheAsshole/comments/1k5olwo/aita_for_not_involving_myself_with_my_mil_when/,True,Not the A-hole
1k5ohp3,AITA because my roommate volunteered me without asking me,"My roommate and I been friends for 14 years, and three years ago we decided to move in together. She has a 13 yrld daughter and my 20 year old lives with us. We have our ups and downs but so far it's been great. She's much younger than me and deaf for context. We both work at the same job but she works a second one for a little extra cash. Today her daughter had tryouts for volleyball and when they got home she told me her mom said I'd be picking her up from practice if she made the team. She never ran that by me. I'm usually pretty tired after work, so getting back out around 6 pm isn't the thing I wanna do. AITA if I tell her I can't and she'll have to figure it out?",AmItheAsshole,Foxygal47,18,0.88,18,2025-04-23 02:32:28+00:00,Not the A-hole,https://www.reddit.com/r/AmItheAsshole/comments/1k5ohp3/aita_because_my_roommate_volunteered_me_without/,True,Not the A-hole
1k5ogsv,AITA for holding 2 year old daughter when she was having a meltdown?,"I (20's, M) have a 2yr old daughter, we'll call her Meredith for the sake of this post. Our lives have been a bit chaotic in the past month. We moved houses, Meredith went to preschool for the first time, and then Baby #4 arrived. She's always been our more emotional kiddo, but with all of the changes in her life lately, the crying is more frequent. I think she's super overwhelmed. 


Yesterday was one of those days where everything was setting her off. Eventually, Meredith just got to a point where she was sobbing and I couldn't distract her, talk her through it, or anything else. So I picked her up and snuggled her for a bit, and she calmed down. 


My wife was not impressed with this at all. She said that we need to be ""on the same page as preschool"" because they don't cuddle everybody that cries there. She said that Meredith needs to learn to self soothe and that me holding her ""undermines the coping strategies that Meredith is developing"". 



AITA for holding 2 year old daughter when she was upset/having a meltdown?  


",AmItheAsshole,NS005,744,0.91,263,2025-04-23 02:31:16+00:00,Not the A-hole,https://www.reddit.com/r/AmItheAsshole/comments/1k5ogsv/aita_for_holding_2_year_old_daughter_when_she_was/,True,Not the A-hole
1k6hiw0,"AITA for not let my grandma eat her ""dinner""","Hi, i am 19 boy who live with my grandma with 79 years old, my grandma she suffer from alzheimer, and one day while I was returning from work, my grandmother was waiting for me to eat dinner, but the problem was she has already eat the dinner, because always when she eat breakfast, lunch or dinner, me and my uncle always force her to write that she consumed the medicament, and because she said ""let's eat dinner together"", I corrected her saying ""grandma you already eat the dinner"" and when always this happen, or my grandma ignore what I say and go to eat together or she refused she do such a thing, and in that case was the last case, so I show her te write she wrote, but this just let her wrathful because she wasn't accepting that she have alzheimer.

plus because she have puts rice, beans and sausage in the rice cooker with made them heated, I stop her when she was trying to heat the beans, she became very angry and decide to eat dinner, with made her go to my uncle house as 10:00 PM to trying to complain, but because I knew that my uncle was sleeping, I follow her, where finish with my cousin trying to stop the fight, resulting my grandma very angry locking her room

Am I asshole because of that?",AmItheAsshole,renan30013,1,0.56,11,2025-04-24 02:37:36+00:00,No A-holes here,https://www.reddit.com/r/AmItheAsshole/comments/1k6hiw0/aita_for_not_let_my_grandma_eat_her_dinner/,True,No A-holes here
1k656iz,AITA for not crying about my 15yo nephew going to juvie?,"My mom sent me(26F) a screenshot this morning of texts between her and my sister (36yo). We live down south now, they’re up on the east coast. We found out yesterday my sis had to pick my nephew (15yo) up from the police station for getting caught at a party with a gun (his fingerprints are on it and he has pictures on his phone with it), he was put on probation. All he cared about was getting his phone back from the cops. Today’s update is that the police took him to juvie (not sure why yet).

In Nov 2023 my nephews dad passed away and although him and my sister were not together, they were still best friends since their teens, & it’s been hard on everyone. He’s been smoking bud (with my sisters permission, no one else approves), skipping school, will turn his location off and not answer the phone, and constantly tries to scam everyone out of money by threatening to be on the streets to get it instead. He also posts pictures on social media with gang-related poses.

My dad and my brother should be there for him, they aren’t the best examples of men but they’re stayed out of jail. There aren’t really any other men who are positive examples for him to follow either like a mentor. Being long distance there’s only so much my mom and I can do but talk to him about his choices and where they’re leading him. I feel I’ve done everything I can to support them without putting myself out, including financially. 

My initial reply: That’s the consequences of his actions *nephew & sis* are gonna learn one way or another 

Mom: No it’s *SIS* fault 
She’s the parent and her job is to guide him and protect him and she did not. She let him loose on the streets to do whatever. SMH. must be nice not to be affected by it though

Me in drafts: Idk what you want me to say I’ve tried talking to both of them up to this point nobody was listening so unfortunately, I’m not surprised it got this far. I’m not gonna stress myself out over something I can’t fix. 

I want to hit send but feel like maybe I am being cold. AITA for not being so emotionally affected?

TLDR/my 15yo nephew got sent to juvie after what seemed like a long time coming. He’s being acting out since his dad passed in 2023 and no one knows how to help. My sister refuses to get therapy for either of them. We live in different states so I can’t do much. I’m disappointed but not surprised at this outcome. My mom seems upset I’m not crying or stressed. AITA for how I responded?",AmItheAsshole,Fabulous-Sail5954,934,0.93,121,2025-04-23 17:34:55+00:00,No A-holes here,https://www.reddit.com/r/AmItheAsshole/comments/1k656iz/aita_for_not_crying_about_my_15yo_nephew_going_to/,True,No A-holes here
1k64de3,"AITA for taking my Hoover Constellation to get fixed, against mom's wishes","I (21f), have a Hoover Constellation, Stella (52). Stella was working fine up until recently, when she started sparking (it was like a lightning flash inside her motor), her suction decreased, and her motor didn't sound as strong. I doubt there is anything mechanically wrong, since her floating function (this model's exhaust is vented towards the bottom), was working perfectly. I believe it's her suppressor, which she can live without, and is in fact a common procedure to remove it in these machines. 

However, mom (61f) is insistent that I should delay the work, given it falls on a uni day for me (it was the only day I could get her in). I explained that it was the only option, and she insisted I should change the date. I am standing my ground. It is literally the only date available to get her in. 

AITA?",AmItheAsshole,HooverConnie,4,0.75,26,2025-04-23 17:02:53+00:00,No A-holes here,https://www.reddit.com/r/AmItheAsshole/comments/1k64de3/aita_for_taking_my_hoover_constellation_to_get/,True,No A-holes here
1k61o5j,WIBTA if I applied for a job I learned about through my friend if I was going to learn about it anyway?,"My coworker and I are pretty close. I would consider her a friend. We both:

* work at our university
* are majoring in English (although, she is double majoring in psychology too)
* are looking for stuff to put on our resume, which we've discussed before
* use the same site for job-hunting, because it's offered through our school

During a shift, she told me about a job under our school's English department she was interested in, because it would look really good on a resume. I also really want to apply for this job (since it would look good for the industry I want to pursue and networking is extremely important), but I learned about it through her. **Under any other circumstance, I would straight-up just not apply, because that's low as hell.**

The thing is, I know for a fact I would have *eventually* found this job posting on my own since I have been checking for new job/internship opportunities every few days for the past couple of weeks *on the same site*. But again, I technically did learn about it through her, so I feel like it comes across as me trying to steal an opportunity from her. And I guess I kind of would be.

She's a very chill person, but I haven't known her super long and cannot say with certainty that this wouldn't hurt her feelings (assuming I did get the position). However, she already has a lot more experience on her resume than I do, and her ""main"" major is psychology anyway. That's the field she wants to work in.

I really feel at a loss. In this job market, you gotta do what you gotta do to thrive, but I don't want to have bad blood with her or put a hole in our relationship as coworkers and as friends.

Would I be an asshole to apply? And how much of a dick would I be?",AmItheAsshole,No-Bet-1510,7,0.77,23,2025-04-23 15:14:24+00:00,No A-holes here,https://www.reddit.com/r/AmItheAsshole/comments/1k61o5j/wibta_if_i_applied_for_a_job_i_learned_about/,True,No A-holes here
1k5tdhj,AITA for expressing my opinion about a friends husband?,"I 32F, had a friend that I’d been “best friends” with since we were 13. 

In our early 20’s, this friend (we’ll call her L) decided that they wanted to move over seas for a year to experience working in a new country. I was sad, but tried to be supportive as I knew this was what they wanted. 

About 12 months in she met her future husband, we’ll call him D. They moved to another country together and settled down with what seemed to be some sense of stability. I’d been missing her and so asked if she was up for a visit. She said yes, we discussed dates and I booked my flights. 

When I arrived though, it became apparent that her then boyfriend (future husband) D had no interest in spending any time getting to know me.

Fast forwards a couple of years and L reaches out to tell me that they’re both moving back to our home country. I’m excited, happy to have her home and hopeful that D and I can try to build a friendship.

They threw a welcome home party for themselves which actually turned out to be an engagement party. Talking to L’s family who I had been quite close to, I found out D had asked for her entire family’s permission to marry her and as a joke, I made a comment along the lines of “hey, nobody asked me for my permission!” to D.

Everyone had laughed, I’d meant it as a joke and thought it had been taken that way. 

It was apparent that something was wrong though afterwards as every time I invited L and D to an event or party, they would make excuses not to come or only L would come. I finally asked about this and L told me I’d made D uncomfortable with my comment at the engagement party and that he didn’t want to hang out with me. I felt bad and reached out to apologise and clear the air. 

At the time, he accepted my apology but still never came to anything I invited them to. However, for L’s sake I continued to put effort in to trying to build a friendship. 

Cue my 30th birthday where they were both invited. L turned up with her family but D did not come. About an hour into being there L told me they had to leave soon as they had another event to get to and I was admittedly hurt by this, because this birthday was a big deal to me and they had known that.

Now admittedly, I had been drinking *a lot* so I don’t actually remember making the comment I did, but later, after L stopped talking to me and I reached out to find out why, they told me I’d made a comment about D and they didn’t appreciated it, so they’re cut off contact with me with no explanation.  

The comment in question was essentially “I don’t understand what you see in him, but if he makes you happy I’ll support you”. 

I apologised for upsetting them and didn’t deny that I’d probably made that comment because honestly, that’s how I’d felt about him for a while as I had been hurt that it felt like I was the only one putting any effort into both “friendships” for years and that I had gone out of my way to try and be welcoming and supportive only to be rebuffed at every turn.

So, AITA? ",AmItheAsshole,marshmallowmrow,4,0.67,25,2025-04-23 07:35:34+00:00,No A-holes here,https://www.reddit.com/r/AmItheAsshole/comments/1k5tdhj/aita_for_expressing_my_opinion_about_a_friends/,True,No A-holes here
1k5oajh,AITA for telling my girlfriend's family that I don't want to give rides?,"I (24M) recently got my driver's license, so at the moment I'm choosing a car to drive. Here where I live, a car is usually quite expensive and it's not something that people change so often (because it's difficult to have the money to change) - so at the moment I'm choosing a car that suits my needs:

* I live with my parents (temporarily), and they have their own car;
* I go to work in person twice a week, the other days I work from home;
* I usually go out with my girlfriend (25F) at weekends;
* I go to the gym (which is about 400m from home);

So, I found a car that suits me well: the Fiat 500. It's a car that's cheap to maintain and consumes very little.

Well, that said, there was a lunch at my girlfriend's house recently and there was me, her and most of her close family. While we were talking, I mentioned that I'd finally gotten my license and that I was looking to buy a car. Her grandmother asked me which car I had in mind, and I said I was thinking of the Fiat 500 and jokingly pointed out:

""That car would suit me because I don't like giving rides""

As it turned out, the atmosphere at the table became tense, and we soon changed the subject.

The next day, my girlfriend calls me and says that after I left, her siblings and her brother's girlfriend told her that they were very upset by my comment, saying “Gee, we're always willing to give rides” and that I was selfish. My girlfriend and I have been together for 6 years - and if I've almost never asked for a ride. 

When my girlfriend tells me this, she says “You need to understand that my family doesn't understand you the way your family and I understand you” - as if I have some kind of “problem” because I simply don't want to give them a damn ride in my damn car that I haven't even bought yet. 

I take a stand and say to her, ""I didn't say that if I have to, I'll refuse - it doesn't even make sense for the three of them to be hurt by a situation that didn't even happen. They all have cars, they all know how to drive and they would hardly NEED a ride from me.""

In a way, she wanted me to apologize for the comment and sort of say, ""I was joking!"" and laughed it off

But I don't see why I'm wrong in this.

AITA for telling my brother and sister-in-law that I don't want to give other people a ride in a damn, comically small Fiat 500?

TL;DR - I recently got my license and I'm going to buy a tiny car because I don't like hitchhiking. I said that I don't like hitchhiking with my girlfriend's family and now they're upset with me.",AmItheAsshole,r4g3_qu1t3r,146,0.9,67,2025-04-23 02:22:41+00:00,No A-holes here,https://www.reddit.com/r/AmItheAsshole/comments/1k5oajh/aita_for_telling_my_girlfriends_family_that_i/,True,No A-holes here
